{
  "catalog": "pms",
  "schema": "multiple",
  "models": [
    {
      "name": "projects",
      "displayName": "Project",
      "description": "Insurance claims project with lifecycle management",
      "tableReference": {
        "schema": "project",
        "table": "projects"
      },
      "columns": [
        {
          "name": "id",
          "displayName": "Project ID",
          "type": "BIGINT",
          "notNull": true
        },
        {
          "name": "name",
          "displayName": "Project Name",
          "type": "VARCHAR",
          "description": "Human-readable project identifier"
        },
        {
          "name": "status",
          "displayName": "Status",
          "type": "VARCHAR",
          "description": "PLANNING, IN_PROGRESS, ON_HOLD, COMPLETED, CANCELLED"
        },
        {
          "name": "start_date",
          "displayName": "Start Date",
          "type": "DATE"
        },
        {
          "name": "end_date",
          "displayName": "End Date",
          "type": "DATE"
        },
        {
          "name": "is_delayed",
          "displayName": "Is Delayed",
          "type": "BOOLEAN",
          "expression": "end_date < NOW() AND status != 'COMPLETED'"
        }
      ],
      "primaryKey": "id",
      "projectScoped": false
    },
    {
      "name": "phases",
      "displayName": "Phase",
      "description": "Project phase representing major milestones",
      "tableReference": {
        "schema": "project",
        "table": "phases"
      },
      "columns": [
        {
          "name": "id",
          "type": "BIGINT",
          "notNull": true
        },
        {
          "name": "name",
          "displayName": "Phase Name",
          "type": "VARCHAR"
        },
        {
          "name": "status",
          "displayName": "Status",
          "type": "VARCHAR",
          "description": "NOT_STARTED, IN_PROGRESS, COMPLETED"
        },
        {
          "name": "progress_percentage",
          "displayName": "Progress",
          "type": "INTEGER",
          "description": "Completion percentage 0-100"
        },
        {
          "name": "sequence_order",
          "displayName": "Order",
          "type": "INTEGER"
        },
        {
          "name": "project_id",
          "type": "BIGINT"
        }
      ],
      "primaryKey": "id",
      "projectScoped": true
    },
    {
      "name": "user_stories",
      "displayName": "User Story",
      "description": "Agile user story for sprint planning",
      "tableReference": {
        "schema": "task",
        "table": "user_stories"
      },
      "columns": [
        {
          "name": "id",
          "type": "BIGINT",
          "notNull": true
        },
        {
          "name": "title",
          "displayName": "Title",
          "type": "VARCHAR"
        },
        {
          "name": "status",
          "displayName": "Status",
          "type": "VARCHAR",
          "description": "TODO, IN_PROGRESS, IN_REVIEW, DONE"
        },
        {
          "name": "story_points",
          "displayName": "Story Points",
          "type": "INTEGER",
          "description": "Effort estimation in Fibonacci scale"
        },
        {
          "name": "priority",
          "displayName": "Priority",
          "type": "VARCHAR",
          "description": "LOW, MEDIUM, HIGH, CRITICAL"
        },
        {
          "name": "sprint_id",
          "type": "BIGINT"
        },
        {
          "name": "project_id",
          "type": "BIGINT"
        },
        {
          "name": "assignee_id",
          "displayName": "Assignee",
          "type": "BIGINT"
        }
      ],
      "primaryKey": "id",
      "projectScoped": true
    },
    {
      "name": "tasks",
      "displayName": "Task",
      "description": "Individual work item under a user story",
      "tableReference": {
        "schema": "task",
        "table": "tasks"
      },
      "columns": [
        {
          "name": "id",
          "type": "BIGINT",
          "notNull": true
        },
        {
          "name": "title",
          "displayName": "Title",
          "type": "VARCHAR"
        },
        {
          "name": "status",
          "displayName": "Status",
          "type": "VARCHAR",
          "description": "TODO, IN_PROGRESS, DONE, BLOCKED"
        },
        {
          "name": "assignee_id",
          "displayName": "Assignee",
          "type": "BIGINT"
        },
        {
          "name": "estimated_hours",
          "displayName": "Estimated Hours",
          "type": "DECIMAL"
        },
        {
          "name": "actual_hours",
          "displayName": "Actual Hours",
          "type": "DECIMAL"
        },
        {
          "name": "user_story_id",
          "type": "BIGINT"
        },
        {
          "name": "completed_at",
          "displayName": "Completed At",
          "type": "TIMESTAMP"
        }
      ],
      "primaryKey": "id",
      "projectScoped": true
    },
    {
      "name": "sprints",
      "displayName": "Sprint",
      "description": "Time-boxed iteration for agile development",
      "tableReference": {
        "schema": "task",
        "table": "sprints"
      },
      "columns": [
        {
          "name": "id",
          "type": "BIGINT",
          "notNull": true
        },
        {
          "name": "name",
          "displayName": "Sprint Name",
          "type": "VARCHAR"
        },
        {
          "name": "start_date",
          "displayName": "Start Date",
          "type": "DATE"
        },
        {
          "name": "end_date",
          "displayName": "End Date",
          "type": "DATE"
        },
        {
          "name": "status",
          "displayName": "Status",
          "type": "VARCHAR",
          "description": "PLANNING, ACTIVE, COMPLETED"
        },
        {
          "name": "project_id",
          "type": "BIGINT"
        },
        {
          "name": "velocity",
          "displayName": "Velocity",
          "type": "INTEGER",
          "expression": "SELECT SUM(story_points) FROM task.user_stories WHERE sprint_id = sprints.id AND status = 'DONE'"
        }
      ],
      "primaryKey": "id",
      "projectScoped": true
    },
    {
      "name": "issues",
      "displayName": "Issue",
      "description": "Project issue or problem tracking",
      "tableReference": {
        "schema": "project",
        "table": "issues"
      },
      "columns": [
        {
          "name": "id",
          "type": "BIGINT",
          "notNull": true
        },
        {
          "name": "title",
          "type": "VARCHAR"
        },
        {
          "name": "severity",
          "displayName": "Severity",
          "type": "VARCHAR",
          "description": "LOW, MEDIUM, HIGH, CRITICAL"
        },
        {
          "name": "priority",
          "displayName": "Priority",
          "type": "VARCHAR",
          "description": "LOW, MEDIUM, HIGH, CRITICAL"
        },
        {
          "name": "status",
          "displayName": "Status",
          "type": "VARCHAR",
          "description": "OPEN, IN_PROGRESS, RESOLVED, CLOSED"
        },
        {
          "name": "project_id",
          "type": "BIGINT"
        },
        {
          "name": "created_at",
          "displayName": "Created At",
          "type": "TIMESTAMP"
        }
      ],
      "primaryKey": "id",
      "projectScoped": true
    },
    {
      "name": "risks",
      "displayName": "Risk",
      "description": "Project risk identification and tracking",
      "tableReference": {
        "schema": "project",
        "table": "risks"
      },
      "columns": [
        {
          "name": "id",
          "type": "BIGINT",
          "notNull": true
        },
        {
          "name": "title",
          "type": "VARCHAR"
        },
        {
          "name": "probability",
          "displayName": "Probability",
          "type": "VARCHAR",
          "description": "LOW, MEDIUM, HIGH"
        },
        {
          "name": "impact",
          "displayName": "Impact",
          "type": "VARCHAR",
          "description": "LOW, MEDIUM, HIGH, CRITICAL"
        },
        {
          "name": "status",
          "displayName": "Status",
          "type": "VARCHAR",
          "description": "IDENTIFIED, MITIGATING, MITIGATED, OCCURRED"
        },
        {
          "name": "project_id",
          "type": "BIGINT"
        }
      ],
      "primaryKey": "id",
      "projectScoped": true
    },
    {
      "name": "users",
      "displayName": "User",
      "description": "System user accounts",
      "tableReference": {
        "schema": "auth",
        "table": "users"
      },
      "columns": [
        {
          "name": "id",
          "type": "BIGINT",
          "notNull": true
        },
        {
          "name": "username",
          "displayName": "Username",
          "type": "VARCHAR"
        },
        {
          "name": "email",
          "displayName": "Email",
          "type": "VARCHAR"
        },
        {
          "name": "full_name",
          "displayName": "Full Name",
          "type": "VARCHAR"
        },
        {
          "name": "is_active",
          "displayName": "Is Active",
          "type": "BOOLEAN"
        }
      ],
      "primaryKey": "id",
      "projectScoped": false
    },
    {
      "name": "backlogs",
      "displayName": "Backlog",
      "description": "Product backlog container",
      "tableReference": {
        "schema": "task",
        "table": "backlogs"
      },
      "columns": [
        {
          "name": "id",
          "type": "BIGINT",
          "notNull": true
        },
        {
          "name": "name",
          "displayName": "Backlog Name",
          "type": "VARCHAR"
        },
        {
          "name": "project_id",
          "type": "BIGINT"
        }
      ],
      "primaryKey": "id",
      "projectScoped": true
    },
    {
      "name": "backlog_items",
      "displayName": "Backlog Item",